tests/testthat/fixtures/mathematica_reference/Chapter08BNM_Test.csv

"Author","SHOJIMA Kojiro"
"Analysis Date","Wed 25 Feb 2026 00:11:33"
"N of Items","5.0"
"Sample Size","10.0"
"Mean","2.6"
"SE of Mean","0.47609522856952335"
"SD","1.505545305418162"
"Skewness","-0.09884330004903598"
"Kurtosis","-0.7520184544405999"
"Min","0.0"
"Max","5.0"
"Model","Bayesian Network Model"
"Log-Likelihood(Benchmark Model)","-8.935173439629247"
"Log-Likelihood(Null Model)","-28.882329884857484"
"Chi-square(Null Model)","39.894312890456476"
"DF(Null Model)","25.0"
"Log-Likelihood(Analysis Model)","-27.046291065716222"
"Chi-square(Analysis Model)","36.222235252173945"
"DF(Analysis Model)","20.0"
"NFI","0.09204514057844482"
"RFI","0.0"
"IFI","0.18457926436072425"
"TLI","0.0"
"CFI","0.0"
"RMSEA","0.30020581136737534"
"AIC","-3.7777647478260548"
"CAIC","-29.829466607706976"
"BIC","-9.829466607706976"

articles/guide-ja.md

#> 

#> Parameter Learning
    #>        PIRP 1 PIRP 2 PIRP 3 PIRP 4
    #> Item01  0.600                     
    #> Item02  0.250    0.5              
    #> Item03  0.833    1.0              
    #> Item04  0.167    0.5              
    #> Item05  0.000    NaN  0.333  0.667
    #> 
    #> Conditional Correct Response Rate
    #>    Child Item N of Parents   Parent Items       PIRP Conditional CRR
    #> 1      Item01            0     No Parents No Pattern       0.6000000
    #> 2      Item02            1         Item01          0       0.2500000
    #> 3      Item02            1         Item01          1       0.5000000
    #> 4      Item03            1         Item02          0       0.8333333
    #> 5      Item03            1         Item02          1       1.0000000
    #> 6      Item04            1         Item02          0       0.1666667
    #> 7      Item04            1         Item02          1       0.5000000
    #> 8      Item05            2 Item03, Item04         00       0.0000000
    #> 9      Item05            2 Item03, Item04         01        NaN(0/0)
    #> 10     Item05            2 Item03, Item04         10       0.3333333
    #> 11     Item05            2 Item03, Item04         11       0.6666667
    #> 
    #> Model Fit Indices
    #>                  value
    #> model_log_like -27.046
    #> bench_log_like  -8.935
    #> null_log_like  -28.882
    #> model_Chi_sq    36.222
    #> null_Chi_sq     39.894
    #> model_df        20.000
    #> null_df         25.000
    #> NFI              0.092
    #> RFI              0.000
    #> IFI              0.185
    #> TLI              0.000
    #> CFI              0.000
    #> RMSEA            0.300
    #> AIC             -3.778
    #> CAIC           -29.829
    #> BIC             -9.829

#> Parameter Learning
    #>        PIRP 1 PIRP 2
    #> Item01    0.6       
    #> Item02    0.4       
    #> Item03    0.9       
    #> Item04    0.0    0.5
    #> Item05    0.4       
    #> 
    #> Conditional Correct Response Rate
    #>   Child Item N of Parents Parent Items       PIRP Conditional CRR
    #> 1     Item01            0   No Parents No Pattern       0.6000000
    #> 2     Item02            0   No Parents No Pattern       0.4000000
    #> 3     Item03            0   No Parents No Pattern       0.9000000
    #> 4     Item04            1       Item01          0       0.0000000
    #> 5     Item04            1       Item01          1       0.5000000
    #> 6     Item05            0   No Parents No Pattern       0.4000000
    #> 
    #> Model Fit Indices
    #>                  value
    #> model_log_like -27.600
    #> bench_log_like  -8.935
    #> null_log_like  -28.882
    #> model_Chi_sq    37.330
    #> null_Chi_sq     39.894
    #> model_df        24.000
    #> null_df         25.000
    #> NFI              0.064
    #> RFI              0.025
    #> IFI              0.161
    #> TLI              0.068
    #> CFI              0.105
    #> RMSEA            0.248
    #> AIC            -10.670
    #> CAIC           -41.932
    #> BIC            -17.932

#> Parameter Learning
    #>        PIRP 1 PIRP 2
    #> Item01    0.0  0.667
    #> Item02    0.4       
    #> Item03    0.9       
    #> Item04    0.0  0.500
    #> Item05    0.4       
    #> 
    #> Conditional Correct Response Rate
    #>   Child Item N of Parents Parent Items       PIRP Conditional CRR
    #> 1     Item01            1       Item03          0       0.0000000
    #> 2     Item01            1       Item03          1       0.6666667
    #> 3     Item02            0   No Parents No Pattern       0.4000000
    #> 4     Item03            0   No Parents No Pattern       0.9000000
    #> 5     Item04            1       Item01          0       0.0000000
    #> 6     Item04            1       Item01          1       0.5000000
    #> 7     Item05            0   No Parents No Pattern       0.4000000
    #> 
    #> Model Fit Indices
    #>                  value
    #> model_log_like -26.599
    #> bench_log_like  -8.935
    #> null_log_like  -28.882
    #> model_Chi_sq    35.327
    #> null_Chi_sq     39.894
    #> model_df        23.000
    #> null_df         25.000
    #> NFI              0.114
    #> RFI              0.037
    #> IFI              0.270
    #> TLI              0.100
    #> CFI              0.172
    #> RMSEA            0.244
    #> AIC            -10.673
    #> CAIC           -40.633
    #> BIC            -17.633